{
  "observation_id": "om-obs-0001",
  "created_at": "2026-06-25T19:30:00-04:00",
  "system": "omoluabi",
  "observer_id": "observer-local-001",
  "device_id": "om-device-prototype-001",
  "location": {
    "lat": 40.0,
    "lng": -73.0,
    "precision": "approximate"
  },
  "media": {
    "audio": "media/audio.wav",
    "image": "media/image.jpg",
    "transcript": "transcripts/auto-draft.txt"
  },
  "consent_id": "consent-0001",
  "source_id": "source-0001",
  "risk_id": "risk-0001",
  "accessibility_id": "access-0001",
  "ai_assist": {
    "enabled": true,
    "model": "local-or-browser-prototype",
    "task": "transcript draft",
    "confidence": 0.72,
    "human_verified": false
  },
  "publication_status": "internal_review"
}
